{
  "lesson_id": "M03-L08",
  "verdict": "PASS",
  "quality_rubric_version": "2.0-visual-first",
  "summary": "Bản dự thảo M03-L08 đạt chất lượng xuất sắc về tính trung thực nguồn (Source Fidelity) và tính sư phạm (Pedagogical Quality). Bản soạn thảo bám sát toàn bộ bối cảnh tình huống Virtual Verde, dữ liệu khảo sát 70%, 6 nhu cầu cốt lõi của khách hàng, cấu trúc chuẩn của User Story, tiêu chí chấp nhận và khung I.N.V.E.S.T. từ tài liệu gốc. Không có hiện tượng bịa đặt đáp án chính thức cho bài quiz (các gợi ý giải pháp được dán nhãn minh bạch dưới dạng định hướng tư duy sư phạm). Tuyệt đối tuân thủ chính sách cấm hình ảnh giảng viên. Điểm trừ duy nhất là bản draft chưa tích hợp sơ đồ Mermaid trực quan hóa phân cấp Backlog hoặc luồng quy trình thực hành theo chuẩn Visual-First, tuy nhiên đây chỉ là lỗi nhỏ (mức LOW) và không vi phạm bất kỳ Hard Gate nào.",
  "dimension_scores": {
    "SOURCE_FIDELITY": "MET",
    "CONTENT_COMPLETENESS": "MET",
    "PEDAGOGICAL_QUALITY": "MET",
    "VISUAL_PEDAGOGY": "MINOR_ISSUES",
    "TERMINOLOGY_CONSISTENCY": "MET",
    "SOURCE_TRACEABILITY": "MET",
    "CLARITY_ORGANIZATION": "MET",
    "FORMATTING": "MET"
  },
  "findings": [
    {
      "finding_id": "F-001",
      "severity": "LOW",
      "category": "VISUAL_PEDAGOGY",
      "source_locator": "Activity Overview & Step-by-Step Instructions (Step 2 - Step 6)",
      "draft_locator": "Mục 3.4 & Mục 7",
      "description": "Bản draft đang sử dụng công thức văn bản dòng chữ (LaTeX inline) để mô tả phân cấp 'Product Backlog -> Epic -> User Stories -> Acceptance Criteria' và danh sách văn bản thường cho 6 bước thực hành, chưa có sơ đồ Mermaid trực quan hóa cấu trúc phân cấp hoặc quy trình từng bước theo định hướng chuẩn Visual-First.",
      "required_action": "Bổ sung một khối sơ đồ Mermaid (dạng flowchart TD) tại Mục 3.4 minh họa trực quan cấu trúc phân cấp từ Product Backlog đến Epic, User Stories và Acceptance Criteria, hoặc sơ đồ tiến trình 6 bước thực hành tại Mục 7 để tăng cường hiệu quả sư phạm thị giác."
    }
  ],
  "limitations": [
    "Auditor chia sẻ cùng họ mô hình Gemini với Worker.",
    "Học liệu gốc thuộc loại ACTIVITY văn bản kèm Quiz, không có video transcript nên việc đối chiếu nguồn căn cứ trên tiêu đề đề mục và cấu trúc bài tập thay vì mốc thời gian timestamp [mm:ss]."
  ],
  "quality_score": 95.5,
  "content_quality_accepted": true,
  "audited_final_sha256": "c8b2af556888ccc0081372762a8e17fa4cc38c0e1874c59d96d14739b0d22ea1",
  "audit_invocation_id": "inv-auditor-M03-L08-att1-b2db669fa1f8",
  "model_verification": "VERIFIED",
  "visual_figures_audited": 0
}