{
  "lesson_id": "M02-L11",
  "verdict": "PASS",
  "quality_rubric_version": "2.0-visual-first",
  "summary": "Bản dự thảo M02-L11 thể hiện chất lượng biên soạn xuất sắc, tuân thủ nghiêm ngặt chuẩn mực Unified Quality Standard 2.0. Toàn bộ nội dung lý thuyết từ tài liệu gốc (Reading) được chuyển hóa đầy đủ, chuẩn xác, không bịa đặt số liệu hay gán mốc thời gian nguồn giả mạo. Các trích dẫn từ Scrum Guide được dịch thuật trung thực và chuẩn hóa thuật ngữ chuyên ngành. Hệ thống trực quan gồm 3 sơ đồ Mermaid (F01, F02, F03) có tính sư phạm cao, làm rõ cấu trúc tam giác vai trò, ranh giới so sánh với Project Manager truyền thống và quy trình tương tác trong Sprint. Tình huống thực hành được gắn nhãn minh bạch [AI_GENERATED_EXAMPLE]. Bản draft đáp ứng toàn bộ các Hard Gates và vượt ngưỡng chất lượng quy định.",
  "dimension_scores": {
    "SOURCE_FIDELITY": "MET",
    "CONTENT_COMPLETENESS": "MET",
    "PEDAGOGICAL_QUALITY": "MET",
    "VISUAL_PEDAGOGY": "MINOR_ISSUES",
    "TERMINOLOGY_CONSISTENCY": "MET",
    "SOURCE_TRACEABILITY": "MET",
    "CLARITY_ORGANIZATION": "MET",
    "FORMATTING": "MET"
  },
  "findings": [
    {
      "finding_id": "F-001",
      "severity": "LOW",
      "category": "VISUAL_PEDAGOGY",
      "source_locator": "The roles working together",
      "draft_locator": "Mục 3.7 - Hình F03",
      "description": "Sơ đồ Mermaid F03 mô tả tương tác giữa ba vai trò xuyên suốt Sprint. Mặc dù phần giải thích trực quan nêu 'chu trình tương tác tuần hoàn', luồng điều hướng trong sơ đồ hiện kết thúc tuyến tính tại STAGE4 (STAGE1 --> STAGE2 --> STAGE3 --> STAGE4) mà chưa có đường hồi tiếp (feedback loop) thể hiện việc phản hồi của khách hàng được PO đưa trở lại để tinh chỉnh Product Backlog cho các Sprint tiếp theo.",
      "required_action": "Bổ sung một mũi tên liên kết phản hồi nét đứt từ PO_ACT2 (hoặc STAGE4) quay ngược lại STAGE1 hoặc Product Backlog (ví dụ: `PO_ACT2 -.->|Cập nhật & Tinh chỉnh Backlog| PO_ACT1`) để hoàn thiện trực quan tính chu kỳ (iterative/cyclical) của Scrum."
    }
  ],
  "limitations": [
    "Auditor chia sẻ cùng họ mô hình Gemini 3.8 Flash High với Worker.",
    "Tài liệu gốc là bài đọc (Reading) kèm audio đọc bài nên các mốc locator chủ yếu dựa trên tiêu đề đề mục và mốc thời gian audio tổng quan [0:06/7:50]."
  ],
  "quality_score": 95.5,
  "content_quality_accepted": true,
  "audited_final_sha256": "75f03e0f67375c87f75d2bd5061274becb2435422ceb473dfb3b49600fbd64e3",
  "audit_invocation_id": "inv-auditor-M02-L11-att1-16e8e82af733",
  "model_verification": "VERIFIED",
  "visual_manifest_sha256": "8ad410f23accf861738d72f204b3dceee8383151f0b5e8048f2c34ffda44e8bd",
  "visual_figures_audited": 3
}